<?xml version='1.0' encoding='UTF-8' standalone='no'?>
<?xml-stylesheet href="dialog.xsl" type="text/xsl"?>
<!--<!DOCTYPE dialog SYSTEM	"dialog.dtd">-->
<dialog skin='dark' defbtn='done'>
	<pict name='pic' type='item' num='0' top='9' left='8'/>
	<text size='large' top='6' left='45' width='102'>Item Info:</text>
	<text name='name' framed='true' top='33' left='101' width='141' height='16'/>
	<text name='type' framed='true' top='61' left='58' width='141' height='16'/>
	<text name='val' framed='true' top='61' left='245' width='47' height='16'/>
	<text name='dmg' framed='true' top='89' left='58' width='25' height='15'/>
	<text name='bonus' framed='true' top='89' left='146' width='25' height='15'/>
	<text name='def' framed='true' top='89' left='231' width='25' height='15'/>
	<text name='enc' framed='true' top='117' left='65' width='25' height='16'/>
	<text name='use' framed='true' top='118' left='138' width='26' height='16'/>
	<text name='lvl' framed='true' top='118' left='255' width='25' height='16'/>
	<text name='abil' framed='true' top='168' left='61' width='230' height='16'/>
	<button name='done' type='done' top='191' left='228'/>
	<button name='left' type='left' def-key='left' top='191' left='84'/>
	<button name='right' type='right' def-key='right' top='191' left='153'/>
	<led name='id' state='off' top='8' left='213'/>
	<led name='magic' state='off' top='8' left='280'/>
	<!--
	 TODO: This originally had width=11 height=6; if it looks wrong in-game, try reverting to that
	 TODO: Reinstate item descriptions
	 -->
	<text size='large' top='192' left='8' width='0' height='0'>Description:</text>
	<text name='desc' framed='true' top='210' left='8' width='12' height='6'/>
	<text name='weight' framed='true' top='142' left='60' width='44' height='15'/>
	<!--
	 TODO: Add the labels to the XML definition
	 -->
</dialog>