<?xml version='1.0' encoding='UTF-8' standalone='no'?>
<?xml-stylesheet href="dialog.xsl" type="text/xsl"?>
<!--<!DOCTYPE dialog SYSTEM	"dialog.dtd">-->
<dialog skin='light' defbtn='okay' debug='true'>
	<field name='poison' top='53' left='206' width='52' height='16'/>
	<field name='breath-str' top='77' left='206' width='52' height='16'/>
	<field name='abil-xtra' top='204' left='382' width='53' height='17'/>
	<field name='loot-item' top='246' left='194' width='64' height='16'/>
	<field name='loot-chance' top='247' left='464' width='64' height='16'/>
	<button name='okay' type='regular' top='325' left='572'>OK</button>
	<button name='cancel' type='regular' top='325' left='506'>Cancel</button>
	<!--
	 TODO: Originally these LED labels would've been bold, I think
	 Note: These LEDs were shifted left 100 pixels to account for the labels swapping sides
	 -->
	<group name='breath-type'>
		<led name='fire' state='off' top='82' left='394' width='100'>Fire</led>
		<led name='cold' state='off' top='97' left='394' width='100'>Cold</led>
		<led name='shock' state='off' top='112' left='394' width='100'>Electricity</led>
		<led name='dark' state='off' top='127' left='394' width='100'>Darkness</led>
	</group>
	<led name='magic-res' state='off' top='283' left='167' width='100'>Resist Magic</led>
	<led name='fire-res' state='off' top='298' left='167' width='100'>Resist Fire</led>
	<led name='cold-res' state='off' top='313' left='167' width='100'>Resist Cold</led>
	<led name='poison-res' state='off' top='328' left='167' width='100'>Resist Poison</led>
	<led name='magic-imm' state='off' top='283' left='320' width='100'>Immune To Magic</led>
	<led name='fire-imm' state='off' top='298' left='320' width='100'>Immune To Fire</led>
	<led name='cold-imm' state='off' top='313' left='320' width='100'>Immune To Cold</led>
	<led name='poison-imm' state='off' top='328' left='320' width='100'>Immune To Poison</led>
	<pict type='dlog' num='16' top='8' left='8'/>
	<text size='large' top='6' left='50' width='158' height='16'>Edit Monster Abilities</text>
	<text framed='true' top='6' left='222' width='111' height='14'>Monster number:</text>
	<text name='num' framed='true' top='8' left='340' width='37' height='14'/>
	<text top='2' left='408' width='184' height='54'>
		Enter properties for this monster type. For a detailed
		description of the fields, see the documentation.
	</text>
	<text top='54' left='7' width='179' height='14'>Monster Poison: (0 - 8)</text>
	<text top='77' left='7' width='190' height='68'>Monster Breath Weapon strength (0 - 40):</text>
	<text top='78' left='268' width='131' height='14'>Breath weapon type:</text>
	<text size='large' top='152' left='7' width='120' height='14'>Special ability:</text>
	<text name='abil-name' framed='true' top='152' left='184' width='183' height='14'/>
	<button name='abils' type='regular' top='149' left='374'>Choose</button>
	<text size='large' top='178' left='7' width='166' height='15'>Create monsters/fields:</text>
	<text name='radiate-name' framed='true' top='178' left='184' width='183' height='14'/>
	<button name='radiate' type='regular' top='175' left='374'>Choose</button>
	<text top='205' left='54' width='118' height='16'/>
	<text name='radiate-param' framed='true' top='205' left='180' width='195' height='14'/>
	<text size='large' top='228' left='7' width='158' height='16'>Special treasure:</text>
	<text top='247' left='23' width='162' height='14'>Item to drop when killed:</text>
	<text top='247' left='270' width='186' height='14'>Chance of dropping: (0-100)</text>
	<text top='279' left='9' width='141' height='14'>Monster resistances:</text>
	<!--
	 Note: These LEDs were shifted left 80 pixels to account for the labels swapping sides
	 -->
	<group name='summon'>
		<led name='s0' state='off' top='153' left='525' width='100'>No Summon</led>
		<led name='s1' state='off' top='168' left='525' width='100'>Type 1</led>
		<led name='s2' state='off' top='183' left='525' width='100'>Type 2</led>
		<led name='s3' state='off' top='198' left='525' width='100'>Type 3</led>
	</group>
	<text top='149' left='440' width='94' height='14'>Summon type:</text>
</dialog>